{
    "$schema": "http://json-schema.org/draft-07/schema#",
    "title": "AI-OS Stage 2A Comparable-Run Evidence",
    "description": "Evidence schema for 3 comparable L0/L1 read-only runs. All cost figures are estimates and must be marked UNVERIFIED_RATE until a confirmed provider rate source exists.",
    "type": "object",
    "required": ["schema_version", "protocol", "provider", "model", "task_fingerprint", "cap", "runs"],
    "properties": {
        "schema_version": { "type": "string", "const": "1.0" },
        "protocol": {
            "type": "object",
            "required": ["id", "task_class", "mode", "tolerance_pct"],
            "properties": {
                "id": { "type": "string", "const": "stage-2a-comparable-run-v1" },
                "task_class": { "type": "string", "description": "non-prompt classification of the task (never the raw task/prompt text)" },
                "mode": { "type": "string", "enum": ["LIVE", "MOCK"] },
                "tolerance_pct": { "type": "number", "description": "accepted variance between local telemetry and provider billing (%)" }
            }
        },
        "provider": { "type": "string" },
        "model": { "type": "string" },
        "task_fingerprint": { "type": "string", "description": "deterministic SHA-256 of prompt + context paths + model" },
        "cap": {
            "type": "object",
            "required": ["cap_usd", "cap_total_tokens"],
            "properties": {
                "cap_usd": { "type": "number", "description": "per-run USD cap; 0 = disabled" },
                "cap_total_tokens": { "type": "integer", "description": "per-run total-token cap; 0 = disabled" },
                "max_output_tokens": { "type": "integer", "description": "per-run max output tokens (LIVE runs)" }
            }
        },
        "rate_status": { "type": "string", "enum": ["UNVERIFIED_RATE", "VERIFIED"] },
        "rate_source": { "type": "string" },
        "verification_status": { "type": "string", "enum": ["UNVERIFIED", "VERIFIED"] },
        "rate_source_url": { "type": ["string", "null"], "description": "canonical official pricing page; owner fills; agent never invents" },
        "retrieved_at_utc": { "type": ["string", "null"], "format": "date-time" },
        "currency": { "type": "string" },
        "price_basis": { "type": "string" },
        "effective_date": { "type": ["string", "null"], "format": "date-time", "description": "official rate effective date; null until confirmed" },
        "stopped_early": { "type": "boolean", "description": "true if the run loop stopped before 3 runs (cap stop or failure)" },
        "stop_reason": { "type": "string", "description": "sanitized reason when stopped_early" },
        "redaction": { "type": "string", "description": "statement of what was never stored (key, prompt, raw payload)" },
        "runs": {
            "type": "array",
            "minItems": 3,
            "maxItems": 3,
            "items": {
                "type": "object",
                "required": ["run_id", "timestamp_utc", "api_calls", "usage", "estimated_cost_usd", "budget_decision", "verdict"],
                "properties": {
                    "run_id": { "type": "string" },
                    "timestamp_utc": { "type": "string", "format": "date-time" },
                    "provider_request_id": { "type": ["string", "null"], "description": "provider-returned request ID, owner fills from billing line items; never the key/payload" },
                    "api_calls": { "type": "integer" },
                    "usage": {
                        "type": "object",
                        "required": ["input_tokens", "output_tokens", "total_tokens"],
                        "properties": {
                            "input_tokens": { "type": "integer" },
                            "output_tokens": { "type": "integer" },
                            "cache_read_tokens": { "type": "integer" },
                            "cache_write_tokens": { "type": "integer" },
                            "reasoning_tokens": { "type": "integer" },
                            "total_tokens": { "type": "integer" }
                        }
                    },
                    "estimated_cost_usd": { "type": ["number", "null"] },
                    "unverified_rate": { "type": "boolean" },
                    "budget_decision": { "type": "string", "enum": ["ALLOW", "BUDGET_EXCEEDED"] },
                    "stop_result": { "type": ["string", "null"], "enum": ["BUDGET_EXCEEDED", null] },
                    "latency_seconds": { "type": "number" },
                    "verdict": { "type": "string" }
                }
            }
        },
        "billing_reconciliation": {
            "type": ["object", "null"],
            "description": "human-entered from provider billing; agent never accesses billing accounts",
            "properties": {
                "billing_period": {
                    "type": ["object", "null"],
                    "description": "matched billing window for the reconciled requests",
                    "properties": {
                        "start_utc": { "type": ["string", "null"], "format": "date-time" },
                        "end_utc": { "type": ["string", "null"], "format": "date-time" }
                    }
                },
                "billed_usd": { "type": ["number", "null"] },
                "variance_pct": { "type": ["number", "null"] },
                "within_tolerance": { "type": ["boolean", "null"] },
                "filled_by_human_at": { "type": ["string", "null"] }
            }
        },
        "billing_waiver": {
            "type": ["object", "null"],
            "description": "explicit owner-approved waiver of billing reconciliation for a bounded pilot; default policy remains: reconciliation required until rate verified and billed_usd entered (waiver is never a silent bypass)",
            "properties": {
                "waived": { "type": "boolean", "const": true },
                "reason": { "type": "string" },
                "scope": { "type": "string" },
                "limitations": { "type": "array", "items": { "type": "string" } },
                "approved_by": { "type": "string" },
                "approved_at_utc": { "type": ["string", "null"], "format": "date-time" }
            },
            "required": ["waived", "reason", "scope", "limitations"]
        }
    }
}
